{
  "verdict_id": "v-t8-1",
  "ticket_id": "t8",
  "ticket_revision": 1,
  "plate_id": "plate-t8",
  "decided_t_ms": 201300,
  "trigger": "plate_at_pass",
  "decision": "pass",
  "confidence": 0.997,
  "pass_threshold": 0.95,
  "reasons": [],
  "flagged": [],
  "chain": [],
  "versions": {
    "policy": "0.1.0",
    "graph": "0.1.0"
  }
}
